,Article,Text
0,07.Sustainability challenges of Artificial Intelligence and Policy Implications.pdf,"
sustainability of digitalisation
discussing implications of artificial intelligence
sustainability challenges of artificial
intelligence and policy implications
automated decision-making based on artificial complex neural networks to quite simple software applications
intelligence is associated with growing expecta- that calculate, weigh up and sort data based on simple rules (cf.
algorithmwatch 2018). in this arcticle, we focus on weak ai,
tions and is to contribute to sustainable develop-
for example decision-making with more or less complex data-
ment goals. which opportunities and risks
learning algorithms.
for the environment, economy and society are yet even weak ai-based systems and applications (in the fol-
associated with artificial intelligence-based lowing we will only use the term ai) allows computers to partly
take over human decision-making and to fully automate sys-
applications and how can they be governed?
tems’ management as, for example, when supporting architects
by friederike rohde, maike gossen,
in constructing new buildings, doctors in making medical deci-
josephin wagner and tilman santarius
sions, recruiters in selecting new employees or assigning uber-
drivers to trips. however, ai uses data and algorithmic reason-
ing to make recommendations that are not transparent – and
a d vances in artificial intelligence (ai) effectiveness have that in many cases not even ai-researchers fully understand.
made its application ubiquitous in many economic sec- therefore, the current rise of ai raises questions of what form
tors. whether speech or facial recognition, computer games or of comprehensive political rules are needed to ensure the hu-
social bots, medical diagnostics or predictive maintenance, or man-centred and ecological use of those technologies. this ar-
autonomous driving, many actors expect opportunities not only ticle helps to shed light on the social, ecological, and economic
for product innovations and new markets but also for new re- implications of ai and on what guidelines, rules and regula-
search perspectives. economic and political actors alike expect tions need to be discussed and implemented to address sus-
ai-based systems and applications to contribute positively to tainability concerns.
sustainability goals (jetzke et al. 2019). these include, for ex- there are two interlinked perspectives of how to relate ai to
ample, the opportunities offered by ai for improving the man- sustainability. the first one refers to employing ai in areas that
agement of smart grids (jungblut this issue), and transport in- contribute to socially and ecological desirable developments,
frastructures, for conducting more precise earth observation, such as climate protection or education (ai for sustainable de-
for creating new weather warning and forecasting systems, or velopment; see jungblut, this issue). we investigate the second
for enhancing solutions for waste and resource management. perspective, which refers to developing, implementing, and us-
ing ai in a way that minimizes negative social, ecological and
economic impacts of the applied algorithms (sustainable ai).
do we really talk about artificial intelligence?
ai is generally used to describe machines (usually com-
rules for responsible artificial intelligence
puters) that mimic cognitive functions, for example by repro-
ducing human decision-making structures through functions over the last decade, several issues concerning the societal
with trainable parameters. ai research typically addresses prob- implications of ai and the respective algorithms have been
lems of reasoning, knowledge representation, planning, learn- discussed intensively, mainly under the concept of ethical ai
ing, natural language processing, and perception. while the guidelines (see jobin et al. 2019 for an overview). aspects such
comprehensive reproduction of human intelligence, usually re- as transparency, trustworthiness, autonomy, and data protec-
ferred to as “strong ai” (e. g., cogprime, cf. goertzel et al. 2014), tion are discussed – while the consideration of ecological and
is still far from real-world application, “weak ai”, such as deep equitable aspects of ai is, by and large, still lacking. the ai eth-
learning, is now increasingly found in numerous applications. ics global inventory (algorithmwatch 2020) identifies more
these forms of “weak ai” are also described as computational than 160 rules or guidelines published by diverse actors includ-
intelligence (poole et al. 1998) or intelligent agents (russell/ ing not only ngos, business associations and trade unions
norvig 2003) as they allow decision preparation, and even im- but also various governments and intergovernmental organi-
plementation, to be delegated to computers. those algorithmic zations such as the united nations and the european union
decision-making processes can include anything from highly (eu). the rules for using ai can range from recommendations
ökologischeswirtschaften online-ausgabe o1.2021 (36) | doi 10.14512/oewo360136 nd/4.0/deed.de), which permits copying and redistributing the material in any medium
36 ökologischeswirtschaften online-ausgabe o1.2021 (36) or format, provided the original work is properly cited, it is dnoot iu s1e0d.1 f4o5r1 c2o/momewerocia3l6 0136
© 2021 f. rohde, m. gossen, j. wagner, t. santarius; licensee iöw and oekom verlag. purposes and it is not remixed, transformed or built upon. the access to the digital ver-
this is an article distri buted under the terms of the creative commons attribution sion of this article is reserved to subscribers of ökologischeswirtschaften until two years
non-commercial no derivates license (http://creativecommons.org/licenses/by-nc- after the date of publication; after two years it is available to all readers.
sustainability of digitalisation
over voluntary commitments to binding regulations, some of
sustainability challenges for artificial
which are currently developed at the eu-level.
intelligence
for example, the ngo irights lab developed the algo.rules,
a catalogue of nine rules that should be adhered to in order to two questions are particularly relevant with regard to sus-
enable and facilitate a socially beneficial design and appropri- tainable development and ai. first, are the data sets generally
ate use of algorithmic systems. these rules include aspects used to train ai algorithms at all useful for transforming exist-
such as strengthening competencies of those who develop, op- ing production and consumption patterns towards sustainabil-
erate and/or make decisions regarding the use of algorithmic ity? the challenge here is that existing data sets provide diverse
systems or define responsibilities in a transparent and reason- information about the past but hardly any information about
able way and not transfer the responsibility to the algorithmic desired futures. therefore, ai trained on historical data sets
system itself, users or people affected by it. other rules define may be biased to reproduce the unsustainable status quo. to
that objectives and expected impact of the use of an algorithmic give an example: ai algorithms can optimize traffic flow man-
system must be documented and assessed prior to implemen- agement in cities or in logistics and thereby contribute to re-
tation, the application must have been tested, and the use of an ducing fuel consumption per kilometre driven. but (how) can
algorithmic system must be identified as such (bertelsmann existing data sets train ai to help sustainably transform the
stiftung/i.rights lab 2020). the compliance with these rules transport system as a whole, e. g., to make it less car-depend-
should be ensured by design when systems are being developed. ent? every weak ai or algorithmic system is only as good as the
the eu has published a white paper providing a general utility function it seeks to optimize and the data that it is based
regulatory regime for developing and implementing ai. the upon. that is, sustainability goals, such as reducing car traffic
white paper is based on recommendations from the high level not only have to be implemented into the utility function of the
expert group on ai, which published its ethical guidelines for respective algorithms but in the political regulations and con-
a trustworthy ai in april 2019 (ai hleg 2019). the white pa- ditions, as well.
per focuses on creating “ecosystems for excellence”, as well as second, how can ai-supported sustainability transforma-
on trust and a safe and trustworthy use of ai. an “ecosystem for tions of production and consumption patterns be democrati-
excellence” mainly refers to the cooperative action of eu mem- cally legitimized? to stay with the transport example: should
ber states to maintain europe’s leading position in research, ai-based recommendations be trimmed to inscribe preferences
promote innovation, expand the use of ai, and achieve the ob- for ecological means of transport (bicycle, bus and train) over
jectives of the european green deal. the “ecosystem for trust” less ecological means of transport (car, taxi, plane)? little doubt,
is based on existing law, in particular on the provisions of the other criteria such as travel time or safety are decisive for us-
general data protection regulation (gdpr) and the directive ers when choosing a mode of transport. a situation may arise
on data protection in law enforcement. in which users cannot clearly understand which criteria (i. e.,
the white paper’s intended eu regulatory regime would ap- which specific set of preferences) are used in an ai-based rec-
ply extended regulation only to ai that contains a particular risk ommendation system to make or propose decisions. to avoid
potential regarding protection of safety and consumer and fun- sustainability transformations becoming visible only through
damental rights (european commission 2020). the white pa- the output of the systems, the algorithms must be as transpar-
per proposes defining high risk cumulatively: ai used in “high ent as possible, as should information on the algorithm train-
risk” sectors such as health, transport, police or jurisdiction ing data. this inclusion could prevent the data analysis from
and ai application that poses significant risks, i. e., the pur- reproducing the discriminatory and unsustainable patterns ex-
pose of the respective ai. regarding for example the health isting in society (wolfangel 2018).
sector there is a difference between using ai for appointment
scheduling in hospitals or using ai for medical diagnosis. the
resource and energy intensities of
commission states that ai for the purpose of “remote biomet-
artificial intelligence
ric identification and other intrusive surveillance technologies
would always be considered high-risk” (european commission the discussion about ai opportunities and risks has only
2020: 18). in germany, the data ethics commission advocates recently begun to take into account how much energy and re-
a five-level risk-based regulatory regime, ranging from no reg- sources ai itself consumes for computing. the training pe-
ulation for the lowest risk ai to a complete ban for the high- riod of an artificial neural network (ann), devour particularly
est risk ai, such as autonomous weapon systems. finally, the large amounts of energy. a study using bert, an ann used
eu announced in the white paper it would foster the develop- for speech recognition, found that the training period alone re-
ment of ai for climate change mitigation and for the protec- sulted in 0.65 tons of co being emitted (strubell et al. 2019).
22
tion of natural resources. considering ai as an enabler, the this amount corresponds to the emissions generated from a
eu aims to combine the european green deal with the devel- return flight between berlin and madrid. however, the study’s
opment of “trustworthy ai made in europe” (european com- frequently cited result that “training a single ai model can emit
mission 2020). as much carbon as five cars in their lifetimes” (hao 2019) is in-
ökologischeswirtschaften online-ausgabe o1.2021 (36) 37
sustainability of digitalisation
""artificial intelligence"":
rof
training deep-learning models increases energy noitaicossa .)9102( )0202.20.72
.t vsc.supg/atad/retsam/bolb/tcapmi/2oclm/moc.buhtig//:sptth
,serdnad
and resource consumption eht no
fo & deveirter(
gniteem ,.v
the multi-layered machine-learning processes of ai-based systems are becoming increasingly ,tdimhcs
complex and need large amounts of compute and energy1). the different applications generally use launna 1fernf#/etupmoc-dna-ia/golb/moc.ianepo//:sptth
,.a
pre-trained, customized models. .pln ,inoiccul
ni
gninrael ,.a
,etsocal
peed
amount of compute & energy consumption of different models ees(cid:31))001valset
rof
snoitaredisnoc
image classification speech recognition moves in a game
&
(e.g. vgg) (e.g. deepspeech2) (e.g. alphazero) upg( 00790.0191:vixra
0,12 pfs-d* 0,25 pfs-d* 400 pfs-d* erawdrah
ycilop :enilno
about 56 kwh2) about 117 kwh2) about 186.667 kwh2)
dna rof ,ia
ygrene esabatad tnirperp nepo
9102
.)9102( yluj & vixra :ni .etupmoc
werdna .ylati dohtem .gninrael
,ecnerolf dna
,mullaccm ,)nilreb enihcam ia
.)8102(
.)trohs ut(
;aynana lca( robal fo snoissime ynnad
iad
scitsiugnil ,xednanreh
*amount of compute needed to train a single model. ,hsenag & wöi nobrac
(peta-flop/s-day corresponds to 1015 floating point ;amme lanoitatupmoc snoitaluclac eht ;oirad
operations per second in one day)3) gniyfitnauq
,lleburts ,iedoma
:secruos nwo
© institute for ecological economy research (iöw), cc-by-nc-sa, www.nachhaltige-digitalisierung.de/en )1 )2 )3
figure 1: “artificial intelligence”: training deep-learning models increases energy and resource consumption
correct (cf. lobe 2019). this often-cited amount of 313 tons of moreover, the development of applications for automated de-
co refers to neural architecture search, very different from cision-making, data processing, tracking, or recommendation
22
training a “typical” ann. notwithstanding, the training of in- systems should take into account alternative methods and tools
creasingly complex deep learning models can be expected to to calculate, predict and classify data. for example, the accuracy
require more compute and hence even more electricity (see of an ann for learning a new task involves an energy-intensive
figure 1). trial-and-error process (strubell et al. 2019) that sometimes only
ensuring that ai – particularly those used for sustainabil- leads to a comparatively small increase in network performance.
ity purposes – generate net benefits by reducing energy and in certain applications that currently use ai, statistical analysis
emissions requires assessing whether the energy consumed in methods, such as linear regressions, with a significantly lower
the training and use phases justifies the intended effects. un- energy consumption can lead to similar results. in addition to
til now, most ai has not been used solely to improve sustain- high power consumption, the ai’s material requirements pose
ability but applied in other fields ranging from optimizing on- further ecological challenges due to the hardware used in data
line advertising to industrial production or medical technology. centres and end-user devices whose production is extremely re-
that is, the impact which derives from this energy intensive source-intensive (see pohl et al. in this issue).
training process is highly dependent on the application. how
much additional energy consumption of future, yet-to-be-de-
ecological sustainability of artificial
veloped, ai can societies justify when, at the same time, they
intelligence
have committed to the unfccc paris declaration and want
to achieve the 1.5 °c climate change goal? it appears evident concerning general sustainability criteria for software, nau-
that ai development must be related more strongly to socially mann et al. (2011) developed a comprehensive catalogue of cri-
and ecologically relevant challenges (jetzke et al. 2019; see jun- teria that take into account an application’s entire software life
gblut in this issue). cycle – from the original coding, over its use, to deinstallation.
38 ökologischeswirtschaften online-ausgabe o1.2021 (36)
sustainability of digitalisation
moreover, the software criteria cover the kind of hardware a cer-
regulation of market power and monopolies
tain software requires. these considerations were further devel-
oped and extended to modern software architectures by also tak- the interests of actors driving the creation of new ai applica-
ing into account the electricity load on a remote server, the local tions and markets will considerably determine whether and to
client, or the network as a transport medium (gröger et al. 2018). what extent ai actually supports a transition towards sustainable
applying a whole-system approach allows for sharpening the production and consumption patterns. the majority of ai today
view for indirect effects, also referred to as higher order effects pursues the aim to personalise services, forecasting customers’
of ict (pohl et al. 2019) which relate to behavioural and struc- purchasing interests and optimizing online marketing and ad-
tural changes, that occur due to new business models or the vertisements (heumann/jentzsch 2019). these applications in-
transformation of everyday practices, such as online shopping. tend to increase both individual and societal levels of consump-
schwartz et al. (2019) propose criteria that are suitable for as- tion, which in many countries are already unsustainably high.
sessing the ecological effects of ai and include criteria such as the marketing of ai-based technologies generates high reve-
co emissions, power consumption, training duration, number nues. for example, in the market segment of multi-purpose as-
22
of parameters, and number of floating-point operations (flop). sistants such as siri or alexa, revenues of usd 11.9 billion are
however, these criteria raise the question of the type of measure- forecast for 2021 (hecker et al. 2017). large tech companies lead-
ment as different computers consume different amounts of en- ing these markets are currently using ai to enhance their mar-
ergy for the same operation. the current project “sustainability ket power and competitive advantages. the related dominance
index for artificial intelligence” [1], a cooperation between the of a few global tech corporations, first and foremost google, am-
advocacy organisation algorithmwatch, the institute for ecolog- azon, facebook, apple, microsoft and a few others, will most
ical economy research (iöw) and distributed artificial intelli- likely continue with the development and commercialization of
gence laboratory (dai) at tu berlin, aims to develop a compre- ai in the future (c. f. kingaby, this issue; staab/butollo 2018).
hensive set of sustainability criteria for ai-based systems and due to the high importance of big data for ai, tech corporations
establish particular guidelines for sustainable ai-development. are reluctant to make “their” data openly available to compet-
in addition to guidelines for developing and applying ai, itors, while using mergers and acquisitions to gain access to
politics can set appropriate regulatory frameworks. oftentimes, further data sources. because the control over large amounts
their focus is not specifically on ai only, but include wider tech- of data functions as a central barrier to ai market entry (wig-
nological developments that are ai-related, such as the gdpr, gerthale 2019), existing competitive challenges associated with
eprivacy directive, energy prices, or the pricing of carbon emis- large platform monopolies are likely to be aggravated in coming
sions. thus, co -taxes on electricity could make the develop- years. since all large tech corporations are shareholder-owned,
22
ment of less complex and energy-saving models more attrac- and hence have to service capital interests on financial markets,
tive – incentivizing software developers and their clients to bal- it is questionable whether increasing market concentration will
ance energy costs with performance benefits. one of the most help ai business models that place people and the planet over
relevant steps, not only for the development of ai but also for profits. today’s antitrust laws are not suited to counteracting
developing data-based applications in general, is the promotion this development. since monopolies are legal under competi-
of green cloud computing and green data centres, as argued by tion law, antitrust laws only take effect when companies abuse
köhn et al. (2020). data centres should be legally bound to pro- their market power to deprive competitors, exploit market part-
vide energy certificates that provide information on their en- ners, or raise unjustifiably high consumer prices.
ergy consumption and performance. by collecting this infor- large concentrations of data in the hands of few actors are
mation in a central data register, establishing and expanding by no means a topic for antitrust and competition laws. if they
new data centres can be better planned and promoted. further- were a topic, large tech companies would no longer be able to
more, cloud services should provide information on their eco- take over ai competitors and start-ups. antitrust law world-
logical impact by way of a co -footprint per service unit (e. g., wide should be reformed accordingly. for example, the initia-
22
per hour, per year). ai-developers should be obliged to report tive “restrict corporate power” [3] urges the german govern-
on the co emissions of the ai-models used, e. g., by way of ment to prohibit dangerous monopolies in the digital economy
22
initiatives such as the “co impact calculator” [2]. creating under cartel law and to create legislation allowing them to be
22
greater transparency would also incentivize cloud providers to disbanded. to counteract the concentration of power on a few
offer more climate-friendly services. large platforms, independent data collaborations are being dis-
finally, overarching incentive instruments for reduced en- cussed (heumann/jentzsch 2019). according to research by the
ergy and resource consumption, such as taxes on co or re- stiftung neue verantwortung (engl. foundation new respon-
22
source, a sustainability-oriented national (or eu-wide) resource sibilty) [4], numerous approaches already exist for jointly us-
policy, or public procurement guidelines could provide further ing data platforms or pools, but so far with little success. the
incentives to enhance the development and use of the most en- state can support data cooperation by providing a distinct reg-
ergy- and resource-efficient ai, and for consumers to choose al- ulatory regime and more legal security, for example with re-
ternatives to ai where possible. gard to liability and data protection. moreover, to curb data mo-
ökologischeswirtschaften online-ausgabe o1.2021 (36) 39
sustainability of digitalisation
nopolies and, at the same time, make data more openly acces- goertzel, b./pennachin, c./geisweiller, n. (2014): a brief overview of
sible for socially- and sustainability-oriented companies and cogprime. in: goertzel, b./pennachin, c./geisweiller, n. (eds.): engineer-
ing general intelligence, part 1. a path to advanced agi via embodied
other causes, governments could establish public data trusts
learning and cognitive synergy. paris, atlantis press. 21–40.
to function as intermediaries between those actors that gener-
gröger, j./köhler, a./naumann, s./filler, a./guldner, a./kern, e./hilty, l./
ate data and those that intend to use it (staab 2019). different maksimov, y. (2018): entwicklung und anwendung von bewertungsgrund-
data trusts could be established for energy-related, mobility-re- lagen für ressourceneffiziente software unter berücksichtigung bestehen-
der methodik. abschlussbericht. dessau-roßlau, umweltbundesamt.
lated, or (smart) city-related data.
hao, k. (2019): training a single ai model can emit as much carbon as five
to protect the interests and safety of consumers, necessary
cars in their lifetimes. www.technologyreview.com/2019/06/06/239031/
regulatory frameworks could also include liability issues (euro- training-a-single-ai-model-can-emit-as-much-carbon-as-five-cars-in-their-
pean commission 2020). due to the difficulty of tracing poten- lifetimes/
heumann, s./jentzsch, n. (2019): wettbewerb um daten – über datenpools
tially problematic decisions made by ai, individuals harmed by
zu innovationen. berlin, stiftung neue verantwortung e. v.
an ai may not have access to evidence crucial for a court case. jetzke, t./richter, s./ferdinand, j./schaat, s. (2019): künstliche intelligenz
relevant eu legislation should be adapted, and ai standardiza- im umweltbereich – anwendungsbeispiele und zukunftsperspektiven im
tion should ensure that processes are comprehensible and ac- sinne der nachhaltigkeit. dessau-roßlau, umweltbundesamt.
jobin, a./ienca, m./vayena, e. (2019): the global landscape of ai ethics
cessible for evidence (german bundestag 2020).
guidelines. in: nature machine intelligence 1/9, 389–399.
finally, discussions are underway about a digital tax at the
köhn, m./gröger, j./stobbe, l. (2020): energie- und ressourceneffizienz
national or european level that would ensure value creation in digitaler infrastrukturen – ergebnisse des forschungsprojektes „green
the digital economy also contributes to financing public tasks cloud-computing”. dessau-roßlau, umweltbundesamt.
lobe, a. (2019): ki ist alles andere als grün. www.spektrum.de/news/
(see ganter, this issue). from a sustainability perspective, a fur-
kuenstliche-intelligenz-verbraucht-fuer-den-lernprozess-unvorstellbar-viel-
ther step would be discussing the allocation of funds solely for energie/1660246
sustainable ai. naumann, s./dick, m./kern, e./johann, t. (2011): the greensoft model:
it is key to ensure that the broad application of ai-based sys- a reference model for green and sustainable software and its engineering.
in: sustainable computing: informatics and systems 1/4, 294–304.
tems, which opinion leaders expect in the future, will be imple-
pohl, j./hilty, l. m./finkbeiner, m. (2019): how lca contributes to the envi-
mented in a sustainable way. modern data-driven architectures ronmental assessment of higher order effects of ict application: a review
and specialized hardware and the peculiarities of machine learn- of different approaches. in: journal of cleaner production 219: 698–712.
ing and ai still lack suitable sustainability criteria. achieving poole, d./mackworth, a./goebel, r. (1998): computational intelligence:
a logical approach. new york, oxford university press.
sustainable ai needs comprehensive guidelines, rules, and reg-
russell, s. j./norvig, p. (2003): artificial intelligence: a modern approach.
ulations. these should ensure a reasonable and purposive use upper saddle river (nj), prentice hall.
of ai with regard to the desired objectives, ecologically sustain- schwartz, r./dodge, j./smith, n. a./etzioni, o. (2019): green ai. http://arxiv.
able, transparent and free from exclusion and discrimination. org/abs/1907.10597
staab, p. (2019): digitaler kapitalismus – markt und herrschaft in der öko-
nomie der unkappheit. frankfurt, suhrkamp.
annotations staab, p./butollo, f. (2018): digitaler kapitalismus – wie china das silikon
valley herausfordert. in: wiso direkt. bonn, friedrich-ebert-stiftung.
[1] www.ioew.de/projekt/sustain_nachhaltigkeitsindex_fuer_kuenstliche_
strubell, e./ganesh, a./mccallum, a. (2019): energy and policy considera-
intelligenz
tions for deep learning in nlp. in: proceedings of the 57th annual meet-
[2] https://mlco2.github.io/impact/
ing of the association for computational linguistics.
[3] www.forumue.de/projekte/konzernmacht-initiative/
vzbv – verbraucherzentrale bundesverband (2020): weißbuch
[4] www.stiftung-nv.de/
zur künstlichen intelligenz. www.vzbv.de/sites/default/files/
downloads/2020/07/27/20-06-30_vzbv_stellungnahme_weissbuch_ki.pdf
references wiggerthale, m. (2019): konzernmacht in der digitalen welt. ökologisches
wirtschaften 33/1: 10.
ai hleg – high level expert group on artificial intelligence (2019): ethics
wolfangel, e. (2018): programmierter rassismus. www.zeit.de/impressum/
guidelines for trustworthy ai. https://ec.europa.eu/digital-single-market/
index
en/news/ethics-guidelines-trustworthy-ai
algorithmwatch (2018): atlas der automatisierung – automatisierte ent-
scheidungen und teilhabe in deutschland. https://atlas.algorithmwatch.
org/wp-content/uploads/2019/07/atlas_der_automatisierung_von_
algorithmwatch.pdf
authors + contact
algorithmwatch (2020): global invetory. https://inventory.algorithmwatch.
org/?sfid=172&sort_order=_sfm_i_date+asc+alpha friederike rohde, maike gossen and josephin wagner
bertelsmann stiftung/i.rights lab (2020): praxisleitfaden zu den algo.rules – are researchers at the iöw.
orientierungshilfen für entwickler:innen und ihre führungskräfte. institut für ökologische wirtschaftsforschung (iöw),
www.bertelsmann-stiftung.de/fileadmin/files/alg/algo.rules_ potsdamer str. 105, 10785 berlin. e-mail: friederike.rohde@ioew.de,
praxisleitfaden.pdf maike.gossen@ioew.de, josephin.wagner@ioew.de, tel.: +49 30 8845940
european commission (2020): white paper on artificial intelligence: a euro-
tilman santarius is professor of social-ecological
pean approach to excellence and trust. commission-white-paper-artificial-
transformation and sustainable digitalisation at the technical university
intelligence-feb2020_en.pdf
of berlin and the einstein center digital futures.
german bundestag (2020): unterrichtung der enquete-kommission künst-
liche intelligenz – gesellschaftliche verantwortung und wirtschaftliche, technical university of berlin, marchstraße 23, 10587 berlin.
soziale und ökologische potenziale. bundestags-drucksache 19/23700. e-mail: santarius@tu-berlin.de, tel.: +49 30 31478838
40 ökologischeswirtschaften online-ausgabe o1.2021 (36)"
